{"baseSha":"aaaaaaaaaaaaaaaaaaaaaaaaaaaaaaaaaaaaaaaa","concurrency":2,"effortPolicyVersion":"plugin-compass.effort-policy.v1","hostEvidenceDigest":"sha256:c3d16f30ece5a5fa4a9f7f6c3c703102e9aac21e0f97cae0094436c6db0c750b","integrationBranch":"cb/integration","integrationExpectedSha":"aaaaaaaaaaaaaaaaaaaaaaaaaaaaaaaaaaaaaaaa","mode":"parallel","normalizedInputDigest":"sha256:faa00a5bae1bffb7279bfb7281f591634defc251ab0dd97b0076d0b08161cbfc","reasons":["Two dependency-ready stories have disjoint scopes and decisive checks."],"runId":"cb-20260901-0123456789abcdef","schemaVersion":"compass-builder.wave-plan.v1","stories":[{"branch":"cb/run/alpha","handoffDigest":"sha256:cccccccccccccccccccccccccccccccccccccccccccccccccccccccccccccccc","recommendedEffort":"low","storyId":"alpha"},{"branch":"cb/run/beta","handoffDigest":"sha256:dddddddddddddddddddddddddddddddddddddddddddddddddddddddddddddddd","recommendedEffort":"medium","storyId":"beta"}],"waves":[{"storyIds":["alpha","beta"],"waveIndex":0}]}
